{
  "intro": {
    "title": "Welcome to Multiplication Fun!",
    "narration": "Hello, friends! Today, we are going to explore a super fun math topic: multiplication! Are you ready to learn how to multiply? Let's get started with a simple example: 3 times 2!",
    "audio_narration": "/Users/karyzheng/nicole---claire/edu-gen/outputs/audio/intro_narration.mp3"
  },
  "explanation": {
    "title": "Understanding 3 x 2",
    "narration": "Multiplication is like adding the same number over and over again. When we say 3 times 2, it means we have 3 groups of 2. Let's think of it like this: if you have 3 bags and each bag has 2 apples, how many apples do you have in total? That's right! You can add 2 + 2 + 2, which equals 6! So, 3 x 2 equals 6!",
    "audio_narration": "/Users/karyzheng/nicole---claire/edu-gen/outputs/audio/explanation_narration.mp3"
  },
  "practice_mcq": {
    "title": "Let's Try a Question!",
    "question": "What is 3 times 2?",
    "options": [
      "4",
      "5",
      "6",
      "7"
    ],
    "correct_answer": 2,
    "explanation": "Great job! The answer is 6 because 3 groups of 2 equals 6. Keep practicing, and you'll be a multiplication master!",
    "audio_question": "/Users/karyzheng/nicole---claire/edu-gen/outputs/audio/practice_mcq_question.mp3",
    "audio_explanation": "/Users/karyzheng/nicole---claire/edu-gen/outputs/audio/practice_mcq_explanation.mp3"
  },
  "summary": {
    "title": "What We Learned Today",
    "narration": "Today, we learned about multiplying numbers, specifically 3 times 2. Remember, multiplication is just a quick way to add the same number again! Keep practicing your multiplication, and you'll be a superstar in math!",
    "audio_narration": "/Users/karyzheng/nicole---claire/edu-gen/outputs/audio/summary_narration.mp3"
  },
  "metadata": {
    "version": "0.1",
    "language": "en-US",
    "tone": "elementary",
    "topic": "Multiplication within 10: 3 x 2",
    "duration_estimate": 39.2,
    "audio_generated": true,
    "voice_used": "nova",
    "audio_files": [
      "/Users/karyzheng/nicole---claire/edu-gen/outputs/audio/intro_narration.mp3",
      "/Users/karyzheng/nicole---claire/edu-gen/outputs/audio/explanation_narration.mp3",
      "/Users/karyzheng/nicole---claire/edu-gen/outputs/audio/practice_mcq_question.mp3",
      "/Users/karyzheng/nicole---claire/edu-gen/outputs/audio/practice_mcq_explanation.mp3",
      "/Users/karyzheng/nicole---claire/edu-gen/outputs/audio/summary_narration.mp3"
    ]
  }
}