{
  "intro": {
    "title": "Welcome to Subtraction!",
    "narration": "Hello, friends! Today, we're going to learn about subtraction using a fun example: 5 minus 2. Are you ready to explore the world of numbers with me?",
    "audio_narration": "/Users/karyzheng/nicole---claire/edu-gen/outputs/audio/intro_narration.mp3"
  },
  "explanation": {
    "title": "Understanding Subtraction",
    "narration": "Subtraction means taking away. When we say 5 minus 2, we start with 5 apples. If we take away 2 apples, how many apples do we have left? Let's count together! 5 apples, take away 2, leaves us with 3 apples. So, 5 minus 2 equals 3!",
    "audio_narration": "/Users/karyzheng/nicole---claire/edu-gen/outputs/audio/explanation_narration.mp3"
  },
  "practice_mcq": {
    "title": "Let's Practice Together!",
    "question": "What is 5 minus 2?",
    "options": [
      "3",
      "4",
      "2",
      "5"
    ],
    "correct_answer": 0,
    "explanation": "That's right! 5 minus 2 equals 3. Great job! Keep practicing, and you'll be a subtraction pro!",
    "audio_question": "/Users/karyzheng/nicole---claire/edu-gen/outputs/audio/practice_mcq_question.mp3",
    "audio_explanation": "/Users/karyzheng/nicole---claire/edu-gen/outputs/audio/practice_mcq_explanation.mp3"
  },
  "summary": {
    "title": "Great Job Today!",
    "narration": "Wow, you did amazing today learning about subtraction! Remember, subtraction is all about taking away. Next time you see numbers, think about how you can subtract them. See you next time!",
    "audio_narration": "/Users/karyzheng/nicole---claire/edu-gen/outputs/audio/summary_narration.mp3"
  },
  "metadata": {
    "version": "0.1",
    "language": "en-US",
    "tone": "elementary",
    "topic": "Subtraction within 10: 5-2",
    "duration_estimate": 30.8,
    "audio_generated": true,
    "voice_used": "nova",
    "audio_files": [
      "/Users/karyzheng/nicole---claire/edu-gen/outputs/audio/intro_narration.mp3",
      "/Users/karyzheng/nicole---claire/edu-gen/outputs/audio/explanation_narration.mp3",
      "/Users/karyzheng/nicole---claire/edu-gen/outputs/audio/practice_mcq_question.mp3",
      "/Users/karyzheng/nicole---claire/edu-gen/outputs/audio/practice_mcq_explanation.mp3",
      "/Users/karyzheng/nicole---claire/edu-gen/outputs/audio/summary_narration.mp3"
    ]
  }
}